{
  "$schema": "https://json-schema.org/draft/2020-12/schema",
  "title": "Atlas match result, version 1",
  "type": "object",
  "required": ["version", "criteria_hash", "checked", "hidden", "rows"],
  "additionalProperties": false,
  "properties": {
    "version": {"const": 1},
    "criteria_hash": {"type": "string", "pattern": "^[0-9a-f]{64}$"},
    "checked": {"type": "integer", "minimum": 0},
    "hidden": {"type": "integer", "minimum": 0},
    "rows": {
      "type": "array",
      "items": {
        "type": "object",
        "required": ["subject_id", "score", "known", "results", "display"],
        "additionalProperties": false,
        "properties": {
          "subject_id": {"type": "string"},
          "score": {"type": "number", "minimum": 0, "maximum": 1},
          "known": {"type": "number", "minimum": 0, "maximum": 1},
          "must_unknown": {"type": "array", "minItems": 1, "items": {"type": "string"}},
          "results": {
            "type": "array",
            "items": {
              "type": "object",
              "required": ["id", "outcome"],
              "additionalProperties": false,
              "properties": {
                "id": {"type": "string"},
                "outcome": {"enum": ["met", "unmet", "unknown", "partial", "n/a"]},
                "evidence": {"type": "string"}
              }
            }
          },
          "display": {"type": "object"}
        }
      }
    }
  }
}
